{
	"name": "fs",
	"description": "A cross platform fs library for lde.",
	"authors": [
		"David Cruz <david@bycruz.dev>"
	],
	"git": "https://github.com/lde-org/fs.git",
	"branch": "master",
	"versions": {
		"0.1.0": "bc8342a49d667b807152ac95191f3818035d1a48",
		"0.2.0": "7babb8f41184dc80834fbf55a5528f39d6df111e",
		"0.2.1": "c52fd12402518db5a1f41f4a189b8376261790d9",
		"0.3.0": "54160bc07dd1afedbf449843f1564bfbd6b82960"
	}
}
