{
	"name": "fstrings",
	"description": "Adding string interpolation to lua",
	"authors": [
		"Leonard Mafeni <komemafeni944@gmail.com>"
	],
	"git": "https://codeberg.org/kmafeni04/fstrings-lua.git",
	"branch": "main",
	"versions": {
		"0.1.1": "86cae053f453ab52b38f74342277ddbb4305fd36",
		"0.2.0": "05805a1ad28bf4e7b295a4d8e12be2fe1e6a9563"
	}
}
