{
	"name": "sstream",
	"description": "A library to compose strings",
	"authors": [
		"Leonard Mafeni <komemafeni944@gmail.com>"
	],
	"git": "https://codeberg.org/kmafeni04/sstream-lua.git",
	"branch": "main",
	"versions": {
		"0.1.2": "383499688dbec7ba1ecc7d341887459ad76ea1f7",
		"0.1.3": "ec24b21b6292250f853bfaa3a7a043f9dbef1414",
		"0.1.4": "d03e6ecfc43693fce12239eb40cf7bfb61089099"
	}
}
