{
	"name": "cowsay",
	"description": "A cow that says things",
	"authors": [
		"David Cruz <david@bycruz.dev>"
	],
	"git": "https://github.com/bycruz/cowsay.git",
	"branch": "master",
	"versions": {
		"0.1.0": "d8a5f0a74a90f3dc20f907d18dc13ec8dc57cd9a",
		"0.2.0": "de1ae8bfda94359608cdda0364631f382b5b39c1"
	}
}
