{
	"name": "lua-sys",
	"description": "LuaJIT C api bindings for lde.",
	"authors": [
		"David Cruz <david@bycruz.dev>"
	],
	"git": "https://github.com/lde-org/lua-sys.git",
	"branch": "master",
	"versions": {
		"0.1.0": "9246e262d0388a744ebe2aa838fdf8a552d67755",
		"0.1.1": "3a9a1b1f2b18ca9cd029b66ae8935a60c208695b",
		"0.1.2": "0b9985bc6b23f51bc7a27f6b1c5ac390d14e20eb",
		"0.1.3": "1fcf706087f4ea7b9dced8a483315d2a02393576",
		"0.1.4": "e5c76eab9ca44ca906e05b8749809372beac05e1"
	}
}
