{
	"name": "ssdg",
	"description": "A language agnostic documentation generator written",
	"authors": [
		"Leonard Mafeni <komemafeni944@gmail.com>"
	],
	"git": "https://codeberg.org/kmafeni04/ssdg.git",
	"branch": "main",
	"versions": {
		"0.2.3": "825e8554564248cf6c40a96e8913ce6775d19435",
		"0.3.0": "b1cfebb5fe94ba154201a934d22f3d40f4b58697",
		"0.3.1": "f1c2c0c1839ea2418941142bba9aa12a97a0c9b7",
		"0.3.2": "ea9d1abb1ece96fa166f8040066b408af50236f7",
		"0.3.3": "a2688a0bffd87bea60a3b8058e9c49349fdda94c",
		"0.3.4": "b34dc9f719aab0e568f21f283c124e37569fac65",
		"0.3.5": "439014c2dd9b47476425a3dd54f24faf32db6052",
		"0.3.6": "e437635c078e6545de2f8a32d4a7df61bdd66a83"
	}
}
