{
	"name": "tltp",
	"description": "A Teal/LuaJIT HTTP/1.1 web server library",
	"authors": [
		"Leonard Mafeni <komemafeni944@gmail.com>"
	],
	"git": "https://codeberg.org/kmafeni04/tltp.git",
	"branch": "main",
	"versions": {
		"0.1.0": "af639f410282cea7f6f362fd8e1d24e773127353",
		"0.2.0": "ba18a31c85628a320ad02efa3462536f034448da",
		"0.3.0": "108dd1d793cad6cb7a9f025a75be5a3b66760a79",
		"0.3.1": "e3c26cc1d25d3442583669fc7086b12be714bfa8",
		"0.3.2": "13fa639e67b7e8ca695fb002ed6ab1323b6efe4e",
		"0.3.3": "6d48ce9d039783ba19b8fd5de5e65ec4d99b36b1"
	}
}
