{
	"name": "targs",
	"description": "A command line argument parser for lua and teal",
	"authors": [
		"Leonard Mafeni <komemafeni944@gmail.com>"
	],
	"git": "https://codeberg.org/kmafeni04/targs.git",
	"branch": "main",
	"versions": {
		"0.4.0": "0467aa3fa40ccbf3af55392ea135401e4e4a990e",
		"0.4.1": "553e3e866a60253c4c204bc707b8198f90cc3d48",
		"0.4.2": "5f2f43ac32ed70cd1b3fabb99be05701b4001a89",
		"0.4.3": "0fb510b8e78cadfb429d87687641391dc6a17d9a",
		"0.4.4": "4923bd00596b2f389f3c130fb96f3a91f29d6d58",
		"0.4.5": "3d71275b005c7df0867fe170003ee19c0fb2b887",
		"0.5.0": "47bc65aa4dabbcc2c993813a74fcbd9701927881"
	}
}
